{
	"slug": "kalkas",
	"kind": "app",
	"name": {
		"en": "Kalkas",
		"zh-Hant": "嘉衡 Kalkas"
	},
	"tagline": {
		"en": "Calibrated forecasts, committed before the event and scored against the closing market in public.",
		"zh-Hant": "經校準的預測，於事件前記錄，並公開對照收市價評分。"
	},
	"category": {
		"en": "Business",
		"zh-Hant": "商業"
	},
	"url": "https://kalkas.ai",
	"status": "available",
	"services": ["Hosting", "Data"]
}
