{
	"slug": "puzzled",
	"kind": "app",
	"name": {
		"en": "Puzzled",
		"zh-Hant": "Puzzled"
	},
	"tagline": {
		"en": "A free daily brain game: word, logic, number and spatial puzzles, one free puzzle every day.",
		"zh-Hant": "每日免費腦力遊戲：文字、邏輯、數字及空間謎題，每天一道免費謎題。"
	},
	"category": {
		"en": "Games and fun",
		"zh-Hant": "遊戲及娛樂"
	},
	"url": "https://puzzled.gg",
	"status": "available",
	"services": ["Hosting", "Data"]
}
