{
	"slug": "mark",
	"kind": "open-source",
	"name": {
		"en": "Mark",
		"zh-Hant": "Mark"
	},
	"tagline": {
		"en": "README images from one URL: banners, badges, icons and GitHub stats cards.",
		"zh-Hant": "一個網址生成 README 圖像：橫幅、徽章、圖示及 GitHub 統計卡。"
	},
	"category": {
		"en": "Developer tools",
		"zh-Hant": "開發者工具"
	},
	"url": "https://mark.sylphx.com",
	"status": "available",
	"services": ["Hosting"],
	"repo": "SylphxAI/readme-mark",
	"licence": "MIT",
	"docs": "https://github.com/SylphxAI/readme-mark#readme"
}
