{
	"slug": "tachyn",
	"kind": "app",
	"name": {
		"en": "Tachyn",
		"zh-Hant": "疾書 Tachyn"
	},
	"tagline": {
		"en": "Push-to-talk dictation for every app on your Mac, in Cantonese, English or Mandarin.",
		"zh-Hant": "適用於 Mac 上每個應用程式的按鍵說話輸入，支援粵語、英語及普通話。"
	},
	"category": {
		"en": "Productivity",
		"zh-Hant": "效率工具"
	},
	"url": "https://tachyn.ai",
	"status": "early-access",
	"services": ["Hosting", "Data", "Auth", "AI"]
}
